{
  "$schema": "../../schema/quiz.schema.json",
  "id": "q101-150",
  "title": "DP-300 問題集 第3回",
  "range": "問題 101〜150",
  "lang": "ja",
  "questions": [
    {
      "id": 101,
      "question": "Azure SQL Database の db1 があり、その MAXDOP 設定を変更する必要があります。どのように操作すべきですか？（一つ選択）",
      "type": "single",
      "choices": [
        { "label": "A", "text": "Azure SQL Database のリソース制限設定から MAXDOP パラメータを変更する" },
        { "label": "B", "text": "db1 に接続し、ALTER DATABASE SCOPED CONFIGURATION コマンドを実行する" },
        { "label": "C", "text": "db1 のクエリストアから MAXDOP 設定を構成する" },
        { "label": "D", "text": "db1 に接続し、sp_configure コマンドを実行する" }
      ],
      "answer": "B",
      "explanation": "Azure SQL Database では、データベースレベルの MAXDOP（最大並列度）設定を変更するには、データベーススコープ構成（Database Scoped Configuration）を使用します。これは SQL Server 2016 以降で導入された機能で、Azure SQL Database でも利用可能です。\n\n正しい方法は、対象のデータベース（この場合は db1）に接続し、ALTER DATABASE SCOPED CONFIGURATION コマンドを実行することです。具体的には以下のようなコマンドを使用します：\n\n```sql\nALTER DATABASE SCOPED CONFIGURATION SET MAXDOP = 値;\n```\n\n他の選択肢が不適切な理由：\n- sp_configure コマンドは Azure SQL Database ではサポートされていません。これはオンプレミスの SQL Server でのみ使用できるインスタンスレベルの構成コマンドです。\n- リソース制限設定から MAXDOP を直接変更する機能は Azure SQL Database には存在しません。\n- クエリストアはクエリのパフォーマンスデータを収集・表示するための機能であり、MAXDOP 設定を構成するためのものではありません。"
    },
    {
      "id": 102,
      "question": "オンプレミスのデータベースバックアップを Azure に復元する場合、どの SQL Server PaaS サービスを選択すべきですか？（一つ選択）",
      "type": "single",
      "choices": [
        { "label": "A", "text": "Azure SQL Database" },
        { "label": "B", "text": "Azure SQL Managed Instance" },
        { "label": "C", "text": "Azure SQL Elastic Pool" },
        { "label": "D", "text": "Azure SQL Edge" }
      ],
      "answer": "B",
      "explanation": "オンプレミスの SQL Server データベースバックアップ（.bak 形式）を Azure に直接復元する場合、Azure SQL Managed Instance が唯一の選択肢です。\n\nAzure SQL Managed Instance は、オンプレミス SQL Server との高い互換性を持ち、ネイティブの復元機能をサポートしています。.bak ファイルからの直接復元が可能で、移行作業を簡素化できます。\n\n一方、Azure SQL Database は .bak ファイルからの直接復元をサポートしていません。オンプレミスデータベースを Azure SQL Database に移行するには、以下のような別の方法を使用する必要があります：\n- Data Migration Assistant (DMA)\n- Azure Database Migration Service\n- SQL パッケージ（BACPAC）ファイルのインポート\n\nAzure SQL Elastic Pool は、複数の Azure SQL Database をプールしてリソースを共有するための機能であり、バックアップ復元の選択肢ではありません。\n\nAzure SQL Edge は、IoT やエッジデバイス向けの軽量 SQL Server エンジンであり、オンプレミスバックアップの復元先としては設計されていません。"
    },
    {
      "id": 103,
      "question": "Azure SQL Managed Instance で実行されているデータベースの手動バックアップを実行する必要があります。このバックアップ操作を実行するために、BACKUP DATABASE 文に含めるべきオプションはどれですか？（一つ選択）",
      "type": "single",
      "choices": [
        { "label": "A", "text": "WITH COPY_ONLY" },
        { "label": "B", "text": "WITH CHECKSUM" },
        { "label": "C", "text": "WITH COMPRESSION" },
        { "label": "D", "text": "WITH INIT" }
      ],
      "answer": "A",
      "explanation": "Azure SQL Managed Instance では、データベースの手動バックアップを実行する際に、通常のバックアップシーケンスを妨げないようにするために「WITH COPY_ONLY」オプションを使用する必要があります。\n\n「WITH COPY_ONLY」オプションを使用すると、バックアップはログチェーンに影響を与えず、自動バックアップのスケジュールも中断しません。これは特に重要で、Azure SQL Managed Instance の管理バックアップシステムとの競合を避けるために必須です。\n\n他のオプションについて：\n- WITH CHECKSUM：バックアップ中にチェックサムを生成しますが、バックアップシーケンスへの影響は制御しません。\n- WITH COMPRESSION：バックアップファイルを圧縮しますが、バックアップシーケンスには影響しません。\n- WITH INIT：既存のバックアップセットを上書きするオプションで、ログチェーンを破壊する可能性があります。\n\nAzure SQL Managed Instance では、自動バックアップが既定で有効になっているため、手動バックアップを実行する際は、この自動バックアップシステムとの整合性を保つことが重要です。WITH COPY_ONLY オプションを使用することで、既存のバックアップチェーンを中断せずに、特定の時点でのバックアップを安全に作成できます。"
    },
    {
      "id": 104,
      "question": "SQL Server の行レベルセキュリティ（RLS）において、ユーザーが行レベルセキュリティの述語に違反する値への行の更新を防止するブロック述語はどれですか？（一つ選択）",
      "type": "single",
      "choices": [
        { "label": "A", "text": "BEFORE UPDATE" },
        { "label": "B", "text": "AFTER UPDATE" },
        { "label": "C", "text": "AFTER INSERT" },
        { "label": "D", "text": "INSTEAD OF UPDATE" }
      ],
      "answer": "A",
      "explanation": "SQL Server の行レベルセキュリティ（Row-Level Security、RLS）では、テーブルへのアクセスを行レベルで制限するためのセキュリティ機能を提供しています。RLS には主に 2 種類の述語があります：\n\n1. フィルター述語（Filter Predicate）：SELECT、UPDATE、DELETE 操作時に、ユーザーがアクセスできる行をフィルタリングします。\n2. ブロック述語（Block Predicate）：INSERT、UPDATE 操作時に、セキュリティポリシーに違反する変更をブロックします。\n\nブロック述語のタイプには以下があります：\n- BEFORE UPDATE：更新操作が実行される前に評価され、述語に違反する更新をブロックします。\n- AFTER UPDATE：更新後の状態を評価しますが、実際に更新をブロックするのは BEFORE UPDATE です。\n- AFTER INSERT：挿入後の状態を評価します。\n\nしたがって、行レベルセキュリティの述語に違反する値への行の更新を防止するブロック述語は BEFORE UPDATE です。これは更新操作が実行される前に評価され、セキュリティポリシーに違反する変更を事前にブロックする機能を持っています。"
    },
    {
      "id": 105,
      "question": "Azure 仮想マシンのブロックレベルレプリケーションを実行するサービスはどれですか？（一つ選択）",
      "type": "single",
      "choices": [
        { "label": "A", "text": "Azure Site Recovery" },
        { "label": "B", "text": "Azure Backup" },
        { "label": "C", "text": "Azure SQL Database Managed Instance" },
        { "label": "D", "text": "Azure Disk Encryption" }
      ],
      "answer": "A",
      "explanation": "Azure Site Recovery は、オンプレミスおよび Azure 仮想マシンのディザスタリカバリを提供するサービスです。このサービスは、仮想マシンのブロックレベルレプリケーションを実行し、プライマリサイトで障害が発生した場合にセカンダリロケーションへのフェールオーバーを可能にします。\n\nAzure Backup は、データのバックアップと復元を行うサービスですが、ブロックレベルレプリケーションではなく、バックアップの作成と保存を行います。\n\nAzure SQL Database Managed Instance は、SQL Server の完全に管理されたインスタンスを提供するサービスですが、VM 全体のレプリケーションは行いません。\n\nAzure Disk Encryption は、Azure VM のディスクを暗号化するサービスであり、レプリケーション機能は提供していません。"
    },
    {
      "id": 106,
      "question": "Azure サブスクリプションがあります。Azure Virtual Machines 上に SQL Server のインスタンスをデプロイする必要があります。ソリューションは次の要件を満たす必要があります：\n\n- IOPS、容量、スループットなどのカスタムパフォーマンス構成をサポートする\n- コストを最小限に抑える\n\nどのタイプのディスクをソリューションに含めるべきですか？（一つ選択）",
      "type": "single",
      "choices": [
        { "label": "A", "text": "Standard SSD" },
        { "label": "B", "text": "Ultra SSD" },
        { "label": "C", "text": "Premium SSD v2" },
        { "label": "D", "text": "Premium SSD" }
      ],
      "answer": "C",
      "explanation": "【2026-04-21 精査注記】元の解答は A（Standard SSD）でしたが、誤りです。Standard SSD は IOPS・スループットをカスタム設定できません（ディスクサイズに応じた固定上限値のみ）。IOPS・容量・スループットを個別にカスタム設定できるのは Premium SSD v2 と Ultra SSD のみ。コスト最小化の要件も加味すると、Ultra SSD より安価な Premium SSD v2 が正解です。\n\nPremium SSD v2 は、IOPS・容量・スループットを個別に設定できる唯一のディスクタイプです（Ultra SSD も可能だがより高価）。容量・IOPS・スループットをそれぞれ独立してカスタマイズでき、ワークロードに合わせた最適なコスト効率が実現できます。\n\n各ディスクタイプのカスタム設定可否：\n- Ultra SSD: IOPS・スループット・容量をカスタム設定可能。最高性能だが最高コスト。\n- Premium SSD v2: IOPS・スループット・容量をカスタム設定可能。Ultra SSD より低コストで SQL Server に推奨される。\n- Premium SSD: ディスクサイズごとに固定されたIOPS/スループット上限のみ。カスタム設定不可。\n- Standard SSD: ディスクサイズごとに固定された上限のみ。カスタム設定不可。"
    },
    {
      "id": 107,
      "question": "Azure SQL データベース DB3 があります。Microsoft SQL Server Management Studio (SSMS) から、ユーザー DevUser に DB3 のプロパティを表示する権限を付与する必要があります。どの Transact-SQL コマンドを実行すべきですか？（一つ選択）",
      "type": "single",
      "choices": [
        { "label": "A", "text": "GRANT VIEW DATABASE STATE TO DevUser" },
        { "label": "B", "text": "GRANT VIEW DEFINITION TO DevUser" },
        { "label": "C", "text": "GRANT CONNECT TO DevUser" },
        { "label": "D", "text": "GRANT SELECT TO DevUser" }
      ],
      "answer": "B",
      "explanation": "VIEW DEFINITION 権限は、ユーザーにデータベースオブジェクトのメタデータを表示する権限を付与します。これにより、ユーザーはオブジェクトの定義や構造を確認できますが、データ自体にはアクセスできません。SSMS でデータベースのプロパティを表示するには、この権限が必要です。\n\n他の選択肢について：\n- VIEW DATABASE STATE：データベースの動的管理ビュー（DMV）やパフォーマンス関連の情報へのアクセスを許可しますが、プロパティの表示には直接関係しません。\n- CONNECT：データベースへの接続のみを許可します。メタデータの表示権限は含まれません。\n- SELECT：テーブルやビューからデータを読み取る権限を付与しますが、データベースのプロパティ表示には関係ありません。"
    },
    {
      "id": 108,
      "question": "Azure SQL Database のアクティブなジオレプリケーション構成で 2 つのデータベースを運用しています。ジオレプリケーションのラグを監視する必要があります。どのビューをクエリすべきですか？（一つ選択）",
      "type": "single",
      "choices": [
        { "label": "A", "text": "sys.dm_database_replica_states" },
        { "label": "B", "text": "sys.dm_geo_replication_link_status" },
        { "label": "C", "text": "sys.dm_operation_status" },
        { "label": "D", "text": "sys.dm_hadr_database_replica_states" }
      ],
      "answer": "B",
      "explanation": "Azure SQL Database のジオレプリケーション構成におけるレプリケーションラグを監視するには、`sys.dm_geo_replication_link_status` 動的管理ビューを使用します。このビューは、プライマリデータベースとセカンダリデータベース間のレプリケーションの状態と遅延（ラグ）に関する情報を提供します。\n\n`sys.dm_geo_replication_link_status` ビューには以下の重要な列が含まれています：\n- `last_replication_time`：最後にレプリケーションが行われた時刻\n- `replication_lag_sec`：セカンダリがプライマリより遅れている秒数（ラグ）\n- `replication_state`：レプリケーションリンクの状態（0= プライマリ、1= セカンダリ）\n\n他の選択肢について：\n- `sys.dm_database_replica_states`：Always On 可用性グループのレプリカ状態を監視するためのビューで、Azure SQL Database のジオレプリケーションには適していません。\n- `sys.dm_operation_status`：非同期操作の状態を確認するためのビューで、レプリケーションラグの監視には使用しません。\n- `sys.dm_hadr_database_replica_states`：SQL Server（オンプレミス）の Always On 可用性グループ用のビューで、Azure SQL Database には存在しません。"
    },
    {
      "id": 109,
      "question": "Azure SQL Database の db1 があります。最新の TLS バージョンをサポートする App1 というアプリケーションがあります。App1 が最も安全な方法で db1 にアクセスできるようにする必要があります。どうすべきですか？（一つ選択）",
      "type": "single",
      "choices": [
        { "label": "A", "text": "最小 TLS バージョン設定を 1.2 に設定する" },
        { "label": "B", "text": "既定の TLS バージョン設定を受け入れる" },
        { "label": "C", "text": "最小 TLS バージョン設定を 1.0 に設定する" },
        { "label": "D", "text": "接続文字列に Encrypt=True パラメータを追加する" }
      ],
      "answer": "A",
      "explanation": "Azure SQL Database への接続を最も安全にするには、最小 TLS バージョン設定を 1.2 に設定するのが最適です。TLS（Transport Layer Security）はデータ転送時の暗号化プロトコルであり、バージョンが上がるごとにセキュリティが強化されています。\n\nTLS 1.2 は、TLS 1.0 や 1.1 と比較して、より強力な暗号化アルゴリズムとセキュリティ機能を提供します。Microsoft 自身も、セキュリティ上の理由から TLS 1.0 および 1.1 の使用を非推奨としており、TLS 1.2 以上の使用を推奨しています。\n\n他の選択肢について：\n- 既定の TLS バージョン設定を受け入れる選択肢は、将来的に Microsoft がデフォルト設定を変更する可能性があるため、明示的に最新の安全なバージョンを指定する方が確実です。\n- TLS 1.0 に設定する選択肢は、既知の脆弱性があるため、セキュリティリスクが高まります。\n- 接続文字列に Encrypt=True を追加するだけでは、使用される TLS バージョンは指定されないため、最も安全な方法とは言えません。"
    },
    {
      "id": 110,
      "question": "データベース管理者として、障害発生時のリカバリ計画を策定しています。データ損失を最小限に抑えるために、RPO（Recovery Point Objective）を定義する必要があります。RPO とは何ですか？（一つ選択）",
      "type": "single",
      "choices": [
        { "label": "A", "text": "クラスター内のノード数" },
        { "label": "B", "text": "障害発生後にデータを復旧させる必要がある時点" },